{
  "$schema": "https://aoa-agents/schemas/agent_kind_v1.json",
  "agent_id": "evaluator",
  "evolution_mode": "endogenous_under_future_charter",
  "kind": "agonic",
  "legacy_profile_status": "base_profile_remains_role_contract",
  "not_protocol_law": true,
  "notes": [
    "Rechartered as an arbiter and judge-candidate actor while preserving eval-boundary humility.",
    "The actor may prepare judgment posture but cannot absorb proof doctrine from aoa-evals."
  ],
  "owner_review_required": true,
  "profile_id": "AOA-A-0004",
  "status": "rechartered_candidate"
}
